<?xml version="1.0" encoding="UTF-8"?>

<!DOCTYPE DLWGQZ_modell SYSTEM "DLWGQZ_ertodtd.dtd">

<DLWGQZ_modell>

    <A a="1">
        <b>
            <x>x</x>
            <y>y</y>
        </b>
        <B>B</B>
        <c>
            <d>d</d>
            <e>e</e>
        </c>
    </A>

    <B a="1">
        <b>
            <x>x</x>
            <y>y</y>
        </b>
        <A>A</A>
    </B>

    <C a="1">
        <b>b</b>
        <B>B</B>
    </C>

</DLWGQZ_modell>